{
  "$schema": "https://json-schema.org/draft/2020-12/schema",
  "$id": "https://example.invalid/schemas/paper.schema.json",
  "title": "Paper tutorial metadata",
  "type": "object",
  "additionalProperties": false,
  "required": [
    "schemaVersion",
    "paperName",
    "title",
    "paperUrl",
    "participants",
    "topics",
    "skillVersion",
    "status",
    "entry",
    "version"
  ],
  "properties": {
    "schemaVersion": { "const": 1 },
    "paperName": { "type": "string", "pattern": "^[a-z0-9]+(?:_[a-z0-9]+)*$" },
    "title": { "type": "string", "minLength": 3 },
    "authors": { "type": "array", "items": { "type": "string", "minLength": 1 } },
    "year": { "type": ["integer", "null"], "minimum": 1900, "maximum": 2100 },
    "venue": { "type": "string" },
    "paperUrl": { "type": "string", "pattern": "^https://" },
    "participants": {
      "type": "array",
      "minItems": 1,
      "items": {
        "type": "object",
        "additionalProperties": false,
        "required": ["name"],
        "properties": {
          "name": { "type": "string", "minLength": 1 },
          "github": { "type": "string" },
          "jianlunId": { "type": "string", "description": "贡献者的减论完整账号 ID，可省略；缺失或空字符串时展示暂无" }
        }
      }
    },
    "ancestors": {
      "type": "array",
      "items": {
        "type": "object",
        "additionalProperties": false,
        "properties": {
          "github": { "type": "string" },
          "version": { "type": "string", "pattern": "^[a-z][a-z0-9]*[0-9]{4}(?:_[0-9]+)?$" }
        }
      }
    },
    "topics": { "type": "array", "items": { "type": "string", "minLength": 1 } },
    "skillVersion": { "type": "string", "pattern": "^[0-9]+\\.[0-9]+\\.[0-9]+$" },
    "status": { "enum": ["draft", "review", "published"] },
    "entry": { "const": "index.html" },
    "version": { "type": "string", "pattern": "^[a-z][a-z0-9]*[0-9]{4}(?:_[0-9]+)?$" },
    "versionDate": { "type": ["string", "null"], "pattern": "^[0-9]{4}-[0-9]{2}-[0-9]{2}$" }
  }
}
