{
  "schemaVersion": 1,
  "paperName": "hidream_o1_image_a_natively_unified_image_generative_foundation_model_with_pixel_level_unified_transformer",
  "title": "HiDream-O1-Image: A Natively Unified Image Generative Foundation Model with Pixel-level Unified Transformer",
  "authors": [],
  "year": null,
  "venue": "",
  "paperUrl": "https://arxiv.org/abs/2605.11061",
  "participants": [
    {
      "name": "杨皓然",
      "github": "Lxlorange"
    }
  ],
  "topics": [],
  "skillVersion": "1.3.0",
  "status": "review",
  "entry": "index.html",
  "version": "yanghaoran0903",
  "versionDate": "2026-09-03"
}
