{
  "schemaVersion": 1,
  "paperName": "starvla_reducing_complexity_in_vision_language_action_systems",
  "title": "StarVLA-α: Reducing Complexity in Vision-Language-Action Systems",
  "authors": [],
  "year": null,
  "venue": "",
  "paperUrl": "https://arxiv.org/abs/2604.11757",
  "participants": [
    {
      "name": "刘润祥",
      "github": "lrxby"
    }
  ],
  "topics": [],
  "skillVersion": "1.3.0",
  "status": "review",
  "entry": "index.html",
  "version": "liurunxiang0817",
  "versionDate": "2026-08-17"
}
