{
  "schemaVersion": 1,
  "paperName": "driftworld_fast_world_modeling_through_drifting",
  "title": "DriftWorld: Fast World Modeling through Drifting",
  "authors": [
    "Susie Lu",
    "Haonan Chen",
    "Weirui Ye",
    "Yilun Du"
  ],
  "year": 2026,
  "venue": "arXiv:2607.15065 (cs.RO)",
  "paperUrl": "https://arxiv.org/abs/2607.15065",
  "participants": [
    {
      "name": "赵弈麟",
      "github": "yilin-41"
    }
  ],
  "topics": [
    "World Models",
    "Action-Conditioned Video Generation",
    "Robot Manipulation"
  ],
  "skillVersion": "1.3.0",
  "status": "review",
  "entry": "index.html",
  "version": "zhaoyilin0913",
  "versionDate": "2026-09-13"
}
