{
  "schemaVersion": 1,
  "paperName": "toward_generalist_autonomous_research_via_hypothesis_tree_refinement",
  "title": "Toward Generalist Autonomous Research via Hypothesis-Tree Refinement",
  "authors": [],
  "year": null,
  "venue": "",
  "paperUrl": "https://arxiv.org/abs/2606.11926?utm_source=openai",
  "participants": [
    {
      "name": "刘佳兴",
      "github": "mengxin123123"
    }
  ],
  "topics": [],
  "skillVersion": "1.3.0",
  "status": "review",
  "entry": "index.html",
  "version": "liujiaxing0903",
  "versionDate": "2026-09-03"
}
