{
  "schemaVersion": 1,
  "paperName": "a_foundation_model_of_vision_audition_and_language_for_in_silico_neuroscience",
  "title": "A foundation model of vision, audition, and language for in-silico neuroscience",
  "authors": [],
  "year": null,
  "venue": "",
  "paperUrl": "https://arxiv.org/abs/2605.04326v1",
  "participants": [
    {
      "name": "linxuanyu",
      "github": "redzgqs"
    }
  ],
  "topics": [],
  "skillVersion": "1.3.0",
  "status": "review",
  "entry": "index.html",
  "version": "linxuanyu0915",
  "versionDate": "2026-09-15"
}
