{
  "schemaVersion": 1,
  "paperName": "omnieeg_bench_a_standardized_evaluation_benchmark_for_eeg_foundation_models",
  "title": "OmniEEG-Bench: A Standardized Evaluation Benchmark for EEG Foundation Models",
  "authors": [],
  "year": null,
  "venue": "",
  "paperUrl": "https://arxiv.org/abs/2606.00815",
  "participants": [
    {
      "name": "王为",
      "github": "ekshub"
    }
  ],
  "topics": [],
  "skillVersion": "1.3.0",
  "status": "review",
  "entry": "index.html",
  "version": "wangwei0816",
  "versionDate": "2026-08-16"
}
