{
  "schemaVersion": 1,
  "paperName": "from_pixels_to_words_towards_native_one_vision_models_at_scale",
  "title": "From Pixels to Words – Towards Native One-Vision Models at Scale",
  "authors": [],
  "year": null,
  "venue": "",
  "paperUrl": "https://arxiv.org/pdf/2605.28820",
  "participants": [
    {
      "name": "付炘浩",
      "github": "swiftiexh"
    }
  ],
  "topics": [],
  "skillVersion": "1.3.0",
  "status": "review",
  "entry": "index.html",
  "version": "fuxinhao0816",
  "versionDate": "2026-08-16"
}
