{
  "schemaVersion": 1,
  "paperName": "myvlm_personalizing_vlms_for_user_specific_queries",
  "title": "MyVLM: Personalizing VLMs for User-Specific Queries",
  "authors": [
    "Yuval Alaluf",
    "Elad Richardson",
    "Sergey Tulyakov",
    "Kfir Aberman",
    "Daniel Cohen-Or"
  ],
  "year": 2024,
  "venue": "ECCV",
  "paperUrl": "https://arxiv.org/abs/2403.14599",
  "participants": [
    {
      "name": "Jing Yuxi",
      "github": "commoncreate"
    }
  ],
  "topics": [
    "Vision-Language",
    "Personalization",
    "Concept Recognition",
    "Captioning",
    "VQA"
  ],
  "skillVersion": "1.4.0",
  "status": "review",
  "entry": "index.html",
  "version": "jingyuxi1007",
  "versionDate": "2026-10-07"
}
