{
  "schemaVersion": 1,
  "paperName": "personavlm_long_term_personalized_multimodal_llms",
  "title": "PersonaVLM: Long-Term Personalized Multimodal LLMs",
  "authors": [
    "Chang Nie",
    "Chaoyou Fu",
    "Yifan Zhang",
    "Haihua Yang",
    "Caifeng Shan"
  ],
  "year": 2026,
  "venue": "CVPR",
  "paperUrl": "https://arxiv.org/abs/2604.13074",
  "participants": [
    {
      "name": "Jing Yuxi",
      "github": "commoncreate"
    }
  ],
  "topics": [
    "Vision-Language",
    "Personalization",
    "Multimodal",
    "Memory",
    "Persona"
  ],
  "skillVersion": "1.4.0",
  "status": "review",
  "entry": "index.html",
  "version": "jingyuxi1016",
  "versionDate": "2026-10-16"
}
