{
  "schemaVersion": 1,
  "paperName": "videoagent_all_in_one_framework_for_video_understanding_and_editing",
  "title": "VideoAgent: All-in-One Framework for Video Understanding and Editing",
  "authors": [
    "Hengji Zhou",
    "Lingxuan Huang",
    "Jian Wang",
    "Bing Zhou",
    "Si Wu",
    "Lianghao Xia",
    "Chao Huang"
  ],
  "year": 2026,
  "venue": "arXiv",
  "paperUrl": "https://arxiv.org/abs/2606.23327",
  "participants": [
    {
      "name": "李雪彤",
      "github": "snowietongl-boop"
    }
  ],
  "topics": [
    "Video Understanding",
    "Video Editing",
    "Multi-Agent Systems"
  ],
  "skillVersion": "1.0.0",
  "status": "review",
  "entry": "index.html",
  "version": "lixuetong0903",
  "versionDate": "2026-09-03"
}
