{
  "schemaVersion": 1,
  "paperName": "rethinking_on_policy_distillation_of_large_language_models_phenomenology_mechanism_and_recipe",
  "title": "Rethinking On-Policy Distillation of Large Language Models: Phenomenology, Mechanism, and Recipe",
  "authors": [],
  "year": 2026,
  "venue": "arXiv:2604.13016v2",
  "paperUrl": "https://arxiv.org/abs/2604.13016",
  "participants": [
    {
      "name": "liumu",
      "github": "secretpreson"
    }
  ],
  "topics": [
    "Large Language Models",
    "Knowledge Distillation",
    "On-Policy Distillation"
  ],
  "skillVersion": "1.3.0",
  "status": "review",
  "entry": "index.html",
  "version": "liumu0914",
  "versionDate": "2026-09-14"
}
