{
  "schemaVersion": 1,
  "paperName": "alayaworld_interactive_long_horizon_world_modeling_full_technical_report",
  "title": "AlayaWorld: Interactive Long-Horizon World Modeling – Full Technical Report",
  "authors": [],
  "year": null,
  "venue": "",
  "paperUrl": "https://arxiv.org/pdf/2607.18367",
  "participants": [
    {
      "name": "Alaya‑World: Interactive Long‑Horizon World Modeling Full Technical Report",
      "github": "823339"
    }
  ],
  "topics": [],
  "skillVersion": "1.3.0",
  "status": "review",
  "entry": "index.html",
  "version": "maheyun0915",
  "versionDate": "2026-09-15"
}
