{
  "schemaVersion": 1,
  "paperName": "horizonstream_long_horizon_attention_for_streaming_3d_reconstruction",
  "title": "HorizonStream: Long-Horizon Attention for Streaming 3D Reconstruction",
  "authors": [],
  "year": 2026,
  "venue": "arXiv",
  "paperUrl": "https://arxiv.org/abs/2605.23889",
  "participants": [
    {
      "name": "赵建斌",
      "github": "Jianbin-Zhao"
    }
  ],
  "topics": [
    "Streaming 3D Reconstruction",
    "Long-Horizon Attention"
  ],
  "skillVersion": "1.3.0",
  "status": "review",
  "entry": "index.html",
  "version": "zhaojianbin0903",
  "versionDate": "2026-09-03"
}
