{
  "schemaVersion": 1,
  "paperName": "llava_plus_learning_to_use_tools_for_creating_multimodal_agents",
  "title": "LLaVA-Plus: Learning to Use Tools for Creating Multimodal Agents",
  "authors": [],
  "year": null,
  "venue": "",
  "paperUrl": "https://arxiv.org/abs/2311.05437",
  "participants": [
    {
      "name": "fangyuxin",
      "github": "yx-1021"
    }
  ],
  "topics": [],
  "skillVersion": "1.4.0",
  "status": "review",
  "entry": "index.html",
  "version": "fangyuxin1006",
  "versionDate": "2026-10-06"
}
