{
  "schemaVersion": 1,
  "paperName": "deepswe_measuring_frontier_coding_agents_on_original_long_horizon_engineering_tasks",
  "version": "wangyikai0912",
  "versionDate": "2026-09-12",
  "title": "DeepSWE: Measuring Frontier Coding Agents on Original, Long-Horizon Engineering Tasks",
  "authors": [
    "Wenqi Huang",
    "Charley Lee",
    "Leonard Tng",
    "Serena Ge"
  ],
  "year": 2026,
  "venue": "arXiv",
  "paperUrl": "https://arxiv.org/abs/2607.07946",
  "participants": [
    {
      "name": "王绎开",
      "github": "NKU-mexile"
    }
  ],
  "topics": [
    "Coding Agents",
    "Software Engineering Benchmark",
    "LLM Evaluation"
  ],
  "skillVersion": "1.3.0",
  "status": "review",
  "entry": "index.html"
}
