{
  "schemaVersion": 1,
  "paperName": "vl_adapter_parameter_efficient_transfer_learning_for_vision_and_language_tasks",
  "title": "VL-Adapter: Parameter-Efficient Transfer Learning for Vision-and-Language Tasks",
  "authors": [
    "Yi-Lin Sung",
    "Jaemin Cho",
    "Mohit Bansal"
  ],
  "year": 2022,
  "venue": "CVPR",
  "paperUrl": "https://openaccess.thecvf.com/content/CVPR2022/html/Sung_VL-Adapter_Parameter-Efficient_Transfer_Learning_for_Vision-and-Language_Tasks_CVPR_2022_paper.html",
  "participants": [
    {
      "name": "Jing Yuxi",
      "github": "commoncreate"
    }
  ],
  "topics": [
    "Vision-Language",
    "Parameter-Efficient Transfer Learning",
    "Adapter",
    "Multi-task Learning"
  ],
  "skillVersion": "1.3.0",
  "status": "review",
  "entry": "index.html",
  "version": "jingyuxi1005",
  "versionDate": "2026-10-05"
}
