{
  "schemaVersion": 1,
  "paperName": "limix_2m_mitigating_low_rank_collapse_and_attention_bottlenecks_in_tabular_foundation_models",
  "title": "LimiX-2M: Mitigating Low-Rank Collapse and Attention Bottlenecks in Tabular Foundation Models",
  "authors": [],
  "year": null,
  "venue": "",
  "paperUrl": "https://arxiv.org/abs/2606.04485v2",
  "participants": [
    {
      "name": "荆誉熙",
      "github": "commoncreate"
    }
  ],
  "topics": [],
  "skillVersion": "1.3.0",
  "status": "review",
  "entry": "index.html",
  "version": "jingyuxi0915",
  "versionDate": "2026-09-15"
}
