{
  "schemaVersion": 1,
  "paperName": "hy_world_2_0",
  "title": "HY-World 2.0: A Multi-Modal World Model for Reconstructing, Generating, and Simulating 3D Worlds",
  "authors": [
    "Team HY-World"
  ],
  "year": 2026,
  "venue": "arXiv",
  "paperUrl": "https://arxiv.org/abs/2604.14268",
  "participants": [
    {
      "name": "渔歌",
      "github": "u2003yuge"
    }
  ],
  "topics": [
    "World Models",
    "3D Reconstruction",
    "Video Diffusion",
    "3D Gaussian Splatting"
  ],
  "skillVersion": "1.3.0",
  "status": "review",
  "entry": "index.html",
  "version": "yuge0903",
  "versionDate": "2026-09-03"
}
