{
  "schemaVersion": 1,
  "paperName": "flowedit_inversion_free_text_based_editing_using_pre_trained_flow_models",
  "title": "FlowEdit: Inversion-Free Text-Based Editing Using Pre-Trained Flow Models",
  "authors": [
    "Vladimir Kulikov",
    "Matan Kleiner",
    "Inbar Huberman-Spiegelglas",
    "Tomer Michaeli"
  ],
  "year": 2024,
  "venue": "ICCV 2025",
  "paperUrl": "https://arxiv.org/abs/2412.08629",
  "participants": [
    {
      "name": "JunyaoHu",
      "github": "JunyaoHu"
    }
  ],
  "topics": [
    "CV",
    "Flow Matching",
    "Image Editing",
    "Text-based Editing"
  ],
  "skillVersion": "1.3.0",
  "status": "review",
  "entry": "index.html",
  "version": "hujunyao0916",
  "versionDate": "2026-09-16"
}
