{
  "schemaVersion": 1,
  "paperName": "paddleocr_vl_1_6_expanding_the_frontier_of_document_parsing_with_under_optimized_region_refinement_and_progressive_post_training",
  "title": "PaddleOCR-VL-1.6: Expanding the Frontier of Document Parsing with Under-Optimized Region Refinement and Progressive Post-Training",
  "authors": [],
  "year": null,
  "venue": "",
  "paperUrl": "https://arxiv.org/abs/2606.03264",
  "participants": [
    {
      "name": "Yuhui Che",
      "github": "401rk8"
    }
  ],
  "topics": [],
  "skillVersion": "1.3.0",
  "status": "review",
  "entry": "index.html",
  "version": "yuhuiche0903",
  "versionDate": "2026-09-03"
}
