{
  "schemaVersion": 1,
  "paperName": "learning_transferable_visual_models_from_natural_language_supervision",
  "title": "Learning Transferable Visual Models From Natural Language Supervision",
  "authors": ["Alec Radford", "Jong Wook Kim", "Chris Hallacy", "Aditya Ramesh", "Gabriel Goh", "Sandhini Agarwal", "Girish Sastry", "Amanda Askell", "Pamela Mishkin", "Jack Clark", "Gretchen Krueger", "Ilya Sutskever"],
  "year": 2021,
  "venue": "ICML 2021",
  "paperUrl": "https://proceedings.mlr.press/v139/radford21a/radford21a.pdf",
  "participants": [
    {
      "name": "Tabris-Ayanami",
      "github": "Tabris-Ayanami"
    }
  ],
  "topics": ["视觉语言学习", "对比学习", "零样本分类"],
  "skillVersion": "1.4.0",
  "status": "review",
  "entry": "index.html",
  "version": "tabrisayanami1005",
  "versionDate": "2026-10-05"
}
