{
  "schemaVersion": 1,
  "paperName": "voluntary_collusion_in_competing_llm_agents_with_secret_tools",
  "title": "Voluntary Collusion in Competing LLM Agents with Secret Tools",
  "authors": [],
  "year": 2026,
  "venue": "arXiv preprint",
  "paperUrl": "https://arxiv.org/abs/2605.27593",
  "participants": [
    {
      "name": "贾宸",
      "github": "hula111"
    }
  ],
  "topics": [],
  "skillVersion": "1.3.0",
  "status": "review",
  "entry": "index.html",
  "version": "jiachen0912",
  "versionDate": "2026-09-12"
}
