{
  "schemaVersion": 1,
  "paperName": "multi_view_graph_convolutional_network_for_multimedia_recommendation",
  "title": "Multi-View Graph Convolutional Network for Multimedia Recommendation",
  "authors": [],
  "year": null,
  "venue": "",
  "paperUrl": "https://doi.org/10.1145/3581783.3613915",
  "participants": [
    {
      "name": "庞天傲",
      "github": "897208808"
    }
  ],
  "topics": [],
  "skillVersion": "1.3.0",
  "status": "review",
  "entry": "index.html",
  "version": "pangtianao0902",
  "versionDate": "2026-09-02"
}
