{
  "schemaVersion": 1,
  "paperName": "agentswing_adaptive_parallel_context_management_routing_for_long_horizon_web_agents",
  "title": "AgentSwing: Adaptive Parallel Context Management Routing for Long-Horizon Web Agents",
  "authors": [],
  "year": null,
  "venue": "",
  "paperUrl": "https://arxiv.org/abs/2603.27490",
  "participants": [
    {
      "name": "刘浩田",
      "github": "CFLYR"
    }
  ],
  "topics": [],
  "skillVersion": "1.3.0",
  "status": "review",
  "entry": "index.html",
  "version": "liuhaotian0816",
  "versionDate": "2026-08-16"
}
